{
  "schema_version": "1.0.0",
  "report_id": "report.kb_quality",
  "generated_from": [
    "INDEX.json",
    "knowledge_graph/nodes/*.json",
    "knowledge_graph/edges/*.json",
    "references/*.json",
    "metrics/metric_catalog.json",
    "indexes/*.json",
    "testing/kb_quality_gates.json",
    "testing/template_contracts.json"
  ],
  "counts": {
    "indexed_files": 83,
    "coverage_goals": 9,
    "long_docs": 13,
    "json_template_files": 4,
    "nodes": 73,
    "edges": 60,
    "references": 88,
    "metrics": 10,
    "template_contracts": 4,
    "search_tokens": 26505,
    "route_goals": 9,
    "route_query_cases": 21,
    "compact_query_limit": 12,
    "compact_query_cases": 21,
    "summary_doc_cards": 13,
    "summary_node_cards": 73
  },
  "distributions": {
    "file_kinds": {
      "checklist_file": 5,
      "decision_record": 1,
      "edge_file": 5,
      "long_doc": 13,
      "metric_file": 1,
      "node_file": 6,
      "reference_file": 12,
      "report_file": 1,
      "runbook_file": 1,
      "schema_file": 13,
      "search_index": 4,
      "template_file": 7,
      "testing_file": 6,
      "validation_tool": 8
    },
    "node_types": {
      "anti_pattern": 11,
      "concept": 13,
      "metric": 10,
      "pattern": 8,
      "pillar": 9,
      "principle": 12,
      "procedure": 6,
      "technique": 4
    },
    "reference_tiers": {
      "tier_1": 37,
      "tier_2": 38,
      "tier_3": 9,
      "tier_4": 4
    }
  },
  "graph": {
    "connected_component_sizes": [
      73
    ],
    "adjacency_nodes": 73,
    "adjacency_edges": 60
  },
  "coverage": {
    "long_docs_referenced_by_nodes": [
      "doc.anatomy.loop_anatomy_and_patterns",
      "doc.feedback.feedback_verification_observability",
      "doc.foundations.loop_engineering_foundations",
      "doc.governance.stop_conditions_and_multi_agent",
      "doc.harness.harness_and_tooling_layer",
      "doc.lineage.theoretical_lineage",
      "doc.measurement.loop_metrics",
      "doc.practice.adoption_rubric_misconceptions",
      "doc.reading.context_and_lineage",
      "doc.reading.harness_and_multiagent",
      "doc.reading.verification_and_governance",
      "doc.research.loop_engineering_survey",
      "doc.risks.costs_risks_failure_modes"
    ],
    "long_docs_without_node_reference": [],
    "references_used_by_nodes": 25,
    "references_used_outside_reference_db": 88,
    "references_total": 88,
    "references_without_external_use": []
  },
  "quality_gates": {
    "gate_set_id": "quality.loop_principle",
    "verdict": "pass",
    "required_gate_count": 11,
    "passed_required_gate_count": 11,
    "failed_required_gate_ids": [],
    "all_required_passed": true,
    "results": [
      {
        "id": "quality.graph_single_component",
        "required": true,
        "passed": true,
        "metric_path": "graph.connected_component_sizes",
        "actual": [
          73
        ],
        "expected": 73
      },
      {
        "id": "quality.no_orphan_long_docs",
        "required": true,
        "passed": true,
        "metric_path": "coverage.long_docs_without_node_reference",
        "actual": [],
        "expected": 0
      },
      {
        "id": "quality.all_references_used",
        "required": true,
        "passed": true,
        "metric_path": "coverage.references_without_external_use",
        "actual": [],
        "expected": 0
      },
      {
        "id": "quality.generated_index_node_count",
        "required": true,
        "passed": true,
        "metric_path": "graph.adjacency_nodes",
        "actual": 73,
        "expected": 73
      },
      {
        "id": "quality.generated_index_edge_count",
        "required": true,
        "passed": true,
        "metric_path": "graph.adjacency_edges",
        "actual": 60,
        "expected": 60
      },
      {
        "id": "quality.summary_doc_cards_cover_long_docs",
        "required": true,
        "passed": true,
        "metric_path": "counts.summary_doc_cards",
        "actual": 13,
        "expected": 13
      },
      {
        "id": "quality.summary_node_cards_cover_nodes",
        "required": true,
        "passed": true,
        "metric_path": "counts.summary_node_cards",
        "actual": 73,
        "expected": 73
      },
      {
        "id": "quality.template_contracts_cover_json_templates",
        "required": true,
        "passed": true,
        "metric_path": "counts.template_contracts",
        "actual": 4,
        "expected": 4
      },
      {
        "id": "quality.query_case_floor",
        "required": true,
        "passed": true,
        "metric_path": "counts.route_query_cases",
        "actual": 21,
        "expected": 20
      },
      {
        "id": "quality.compact_query_cases_cover_route_cases",
        "required": true,
        "passed": true,
        "metric_path": "counts.compact_query_cases",
        "actual": 21,
        "expected": 21
      },
      {
        "id": "quality.search_token_floor",
        "required": true,
        "passed": true,
        "metric_path": "counts.search_tokens",
        "actual": 26505,
        "expected": 1000
      }
    ]
  }
}
